560, 530, Clearly audience material resource something., 7, 1973-08-08
835, 103, Mr right summer., 3, 2012-01-25
333, 442, Field budget dinner approach before certain business., 7, 2016-07-26
198, 233, Growth other small deep office go., 9, 1996-02-24
569, 764, Perhaps series ask reason know and successful., 1, 1997-09-23
177, 641, Yes office party majority responsibility religious trial., 6, 2010-08-05
718, 870, Perform win speak stand walk., 9, 2001-03-15
50, 67, Bank home owner expert small seven measure., 3, 2005-08-15
109, 749, Employee gas summer cover east., 5, 2000-03-05
894, 682, They green space bar save game establish., 7, 1996-08-30
605, 619, Figure coach teach concern finally about unit., 8, 1980-03-28
587, 387, Bank point apply research after show., 4, 2014-07-17
73, 121, Task write last class., 4, 2005-03-23
35, 411, Me him address place window economic., 5, 1976-10-19
957, 867, Charge nearly skin management read person risk notice., 9, 1975-05-18
815, 965, Position whom vote., 8, 1990-07-14
329, 857, Happy she image go lose today dream on., 5, 1991-06-22
417, 243, Affect arrive outside., 7, 1976-02-01
749, 6, Eye should bag coach individual., 8, 1973-10-31
932, 424, Speech mission though success share want., 3, 2019-03-24
778, 706, Arrive make case store., 4, 1989-11-05
402, 519, Writer TV American to security., 3, 1980-01-01
933, 921, Them capital source receive moment., 5, 1994-03-04
679, 366, Out usually beautiful paper air authority should., 2, 2015-06-11
146, 23, Model also party class chance town., 6, 1990-09-26
943, 205, Thank school little technology fine to positive tell., 5, 2010-08-19
650, 442, Sell but check provide cause stay skill., 5, 2016-07-25
299, 378, Evening leg three and catch six., 6, 1984-01-10
536, 556, Truth hard day boy money about., 9, 2020-01-18
772, 153, Reduce himself such whose consumer., 1, 2011-03-27
241, 869, Those a effect many provide century message room., 8, 2018-04-21
481, 141, Magazine point green., 3, 2012-01-30
790, 519, Subject yourself half thank claim increase young or., 5, 1981-09-01
613, 470, Time over read environment operation follow., 2, 1975-02-22
437, 307, Start certainly tell southern., 7, 1993-08-06
443, 25, Recently step middle cup unit., 9, 1982-08-30
832, 424, Return nor individual idea to once letter., 7, 2017-12-27
380, 368, Local job movement population attention fly thank., 6, 2005-05-30
737, 495, Style off kid thus war., 8, 1981-01-01
230, 165, College old son way my., 2, 1979-06-01
651, 844, Single minute measure one center painting., 6, 2019-08-17
273, 382, Process policy game investment beautiful parent., 7, 1992-07-11
921, 167, Successful old choice., 7, 2003-04-08
307, 540, Early contain heart memory., 9, 1993-05-16
721, 517, Discuss factor business while security energy wonder., 5, 2018-12-31
354, 95, Behavior bad man tell tend respond store., 2, 1999-03-02
294, 923, Now fall dream yeah., 2, 1994-06-13
880, 13, Scene full building national event director., 9, 1985-06-25
419, 428, Small industry issue approach Democrat force support artist., 8, 1976-03-23
269, 593, Could wonder brother toward land., 1, 1978-04-03
347, 52, Story move common sometimes., 2, 2016-10-13
365, 192, Past production born meeting themselves system., 6, 1999-07-01
223, 716, Field stay account., 6, 1986-01-03
727, 658, Wind all teacher., 7, 2017-02-06
75, 52, Fine system plant reason clear., 8, 2013-10-03
338, 264, Forget hundred feel concern great., 2, 1971-03-10
137, 901, Letter business environmental without might rate., 4, 2019-09-23
739, 930, Name wife support process behind., 7, 2011-09-14
443, 138, Company even state only one stand know., 4, 2001-04-08
529, 236, Believe face practice away no., 3, 2009-07-16
106, 607, Education decision organization soon., 9, 1970-08-15
469, 73, Agency reach employee expect animal everyone., 4, 1972-04-13
116, 87, Several think simple keep test., 4, 1989-07-09
210, 565, Enjoy pay him artist decade., 1, 1996-02-04
586, 113, Money stand couple., 9, 2000-07-24
642, 159, North conference opportunity the bar store sure evening., 9, 2013-02-28
464, 105, Respond both memory anyone responsibility enter property arm., 2, 2020-09-15
110, 480, The moment board say., 7, 1971-07-12
96, 97, Follow yes offer order table indicate key., 8, 1992-04-29
39, 315, Entire sister image past likely paper., 4, 2007-03-02
536, 752, Air music film long memory do give., 7, 1985-05-01
102, 149, Game real focus color base., 10, 1979-05-14
445, 37, Wonder direction more leave cup write., 2, 1986-11-25
394, 148, Need age some occur table people news., 10, 1987-06-18
79, 737, Power issue statement red bed., 5, 2013-12-08
257, 729, Radio play his with future guy., 1, 2018-07-19
714, 892, Mind across especially form raise., 1, 1999-01-08
696, 724, Charge people perform strategy cause how scientist., 3, 2002-10-29
454, 935, Always road today throughout., 7, 1982-02-10
429, 786, Rise in beyond large those success generation player., 4, 1999-07-18
517, 404, From fine food., 2, 1983-06-20
255, 893, That mention of better box actually., 8, 1970-04-28
577, 162, Letter reveal data blood., 1, 1970-09-30
603, 489, Particular account exactly first help., 5, 1994-06-05
495, 407, Until money good choose five., 4, 2010-11-16
218, 736, Building within news face describe amount activity., 2, 2005-10-12
863, 112, Front appear wide image television., 8, 1979-09-02
90, 292, Sure us thing child., 6, 2007-01-30
946, 944, People clear serve year some seem write where., 9, 1992-12-11
669, 122, You but really likely camera president those., 8, 2019-04-23
513, 401, Relate capital phone machine., 9, 2008-08-25
13, 206, Between field two drop drug red month., 5, 1972-01-14
859, 148, Painting four public choose back campaign., 2, 2005-10-01
788, 692, Finally available course policy land popular herself., 4, 2018-08-26
652, 350, Former commercial member., 5, 2005-09-28
595, 904, Wrong off issue economy., 10, 2015-12-18
211, 687, Week group information field discussion forget drug hope., 4, 2005-11-29
80, 306, Present evening sit surface., 1, 2005-10-24
991, 555, Republican senior lawyer scientist land take., 5, 2015-02-18
199, 287, Economic the cup east nor education decision., 6, 1981-12-28
828, 807, Office human yeah south him as., 10, 1974-10-22
218, 913, Girl early add hair hard religious central., 8, 2004-06-11
463, 289, Group dinner save born who she., 5, 2017-06-30
191, 810, Past bring enter media., 10, 1980-11-21
491, 196, Should they activity blood program official hope blue., 1, 1998-09-30
831, 216, Respond discover outside when., 7, 1997-11-25
927, 49, Loss tell response whatever., 9, 2014-07-13
484, 6, Practice official protect continue., 3, 1987-01-07
336, 830, Affect arm establish show in., 6, 2018-04-09
417, 220, Reflect first thus., 3, 1990-01-15
247, 466, Risk reveal better carry game., 2, 1991-12-18
850, 829, Build name government recently., 4, 2001-04-12
715, 712, Fact clearly analysis already check., 7, 1989-07-03
568, 780, Prepare trouble role., 6, 2003-04-12
687, 84, Image part old side., 4, 2016-02-29
481, 956, Station maintain be oil performance., 6, 2003-04-13
534, 375, Cut defense imagine girl., 5, 1994-03-20
327, 176, Training whole player to., 3, 1992-07-30
531, 222, Four really film poor memory along particularly meet., 3, 1986-03-22
174, 336, Figure hand claim arrive describe including film., 4, 2015-11-18
15, 810, Poor million poor PM., 7, 1975-01-31
30, 485, Book personal agree sound north system teach decade., 2, 2007-12-30
406, 854, Safe affect environmental could learn end by., 2, 1990-03-12
809, 980, Try left probably yeah thought against., 2, 1998-09-04
505, 140, Whatever religious wide., 3, 1999-06-08
72, 457, Think Mrs economic clear old describe point., 4, 2007-06-08
438, 264, Employee rule its should thousand everyone save., 7, 2019-09-15
749, 926, Understand law focus sing may site., 10, 1978-03-29
309, 555, Easy soldier hard white want., 6, 1985-02-25
143, 284, Bank firm civil different only example., 1, 1972-02-29
632, 653, All speech produce., 7, 1979-06-19
923, 80, East than soon air measure., 7, 1976-09-01
617, 28, Pm mention east region himself., 7, 2016-06-09
446, 979, Industry decade sound decision herself any., 3, 1992-08-09
45, 338, Hit wait site water item worker wide writer., 4, 2016-08-08
318, 564, Pick glass image maybe blue party moment., 4, 2001-06-25
61, 15, Travel direction certainly player political no could., 10, 2004-09-29
820, 235, Center national place dinner near out., 1, 1996-08-03
79, 261, Material fly door explain agency region for., 5, 1986-03-10
14, 801, See almost and admit space next at., 7, 1972-02-24
930, 356, Action check feeling avoid there first., 2, 2007-02-16
924, 806, Owner beautiful expect particular people development., 3, 1978-10-01
412, 175, Modern study store size ever room., 4, 1970-07-13
9, 705, Father others amount letter., 4, 1980-09-11
740, 507, Remember under grow., 5, 1984-06-16
107, 930, Firm speech letter how who., 3, 1999-04-22
568, 586, Push hotel quality alone western., 1, 2001-05-30
145, 454, When weight prove law car decade., 2, 2014-09-22
834, 711, Appear society trouble sell statement choose., 4, 2017-03-06
266, 582, Seek several ok foreign test call whatever., 8, 1986-04-22
353, 351, City over interesting my drug include and., 1, 1984-05-09
966, 247, This lay way hear eat., 10, 2008-11-17
125, 97, With art citizen., 9, 1991-06-29
379, 910, Executive whether better discuss board pay quite national., 6, 1978-05-31
39, 156, Data describe Republican begin condition., 6, 1996-04-27
611, 454, Either ten full grow draw., 4, 1989-07-01
317, 586, Sometimes represent exactly gun., 7, 1971-08-18
964, 807, About task move color., 6, 1993-09-03
725, 125, Save play position today to strong level science., 7, 2005-04-25
128, 924, Rule fine determine., 5, 1981-09-01
248, 537, Yard rock write room peace able., 8, 1973-05-19
733, 355, Though kid idea step., 10, 2005-12-04
945, 907, Dark sense stage series officer poor., 9, 2015-06-16
203, 578, Note anyone friend summer world mean., 8, 1979-11-21
909, 132, Few easy guess claim activity property., 3, 2000-03-23
545, 204, Teach serve among politics middle wish mission., 5, 1972-02-12
920, 786, Point husband different international dog stock., 9, 2010-10-13
496, 908, Energy discuss pass design., 5, 1974-10-06
818, 749, Or enjoy woman commercial., 8, 1974-05-20
864, 924, Bag hospital could still involve bag early threat., 3, 2011-09-03
460, 674, Allow road song hospital movie., 7, 1981-06-19
25, 409, Write day day employee., 8, 1973-07-01
826, 7, Spend often meeting., 8, 1987-01-25
458, 666, According determine health nor., 8, 2010-09-09
520, 22, Method seem finally travel to., 9, 2014-12-30
902, 319, Head difficult inside bed fear., 3, 2010-07-01
312, 385, Instead young central including., 4, 1996-07-10
689, 605, Model guy evening., 3, 2012-11-01
110, 78, Mrs bring dark religious., 8, 1987-12-10
976, 701, Certainly lay car loss painting., 2, 1994-06-09
836, 380, Indeed resource research yes someone charge wait., 4, 1985-04-06
654, 53, Account bed minute our., 10, 1992-06-25
907, 276, Serve family indeed country., 7, 2011-08-04
192, 522, Minute may stop artist effort decide upon., 3, 2002-04-23
125, 678, Fire some manager account., 6, 2002-03-25
41, 838, South employee someone benefit situation., 3, 1985-06-05
796, 161, Movement yeah challenge our., 6, 2019-12-17
355, 359, Forget bank mouth send dog., 6, 2001-01-08
523, 315, Election trial happen site., 2, 2016-06-24
903, 469, Prepare everybody white environment., 9, 2018-02-23
607, 939, Our middle probably which., 2, 2008-09-25
529, 72, Force your question ball American do by., 2, 1973-10-12
404, 205, Can draw color., 10, 2007-02-19
244, 524, Imagine standard candidate management activity., 6, 2000-02-12
670, 963, Team order usually section range., 8, 1976-01-29
47, 253, May often visit exactly available., 2, 1977-09-08
153, 711, Describe note off in., 5, 1975-07-14
384, 401, Past single which exactly., 2, 2010-12-21
933, 988, Town produce toward such., 4, 1988-05-12
727, 479, Money eat him inside., 3, 2004-06-04
220, 624, Trip drive common whom would would town vote., 5, 2001-07-20
701, 897, Others development position station thank her push., 5, 1999-02-05
389, 487, Bag hear up majority work four move college., 1, 1973-08-05
968, 628, Identify establish majority., 5, 2010-06-21
241, 379, Should control voice beyond at defense., 1, 2010-06-10
360, 21, Former community join peace., 10, 2020-06-10
619, 189, Any sense your author modern., 1, 2010-08-20
266, 785, Conference cut prove million southern while situation scene., 4, 1986-03-18
277, 582, Couple wife near within become involve happen., 6, 2010-01-03
855, 285, Social effort physical any trouble., 6, 2011-03-07
342, 915, Decide official worker themselves certainly., 10, 2013-11-26
650, 447, Main instead prevent piece., 4, 2010-05-22
260, 436, Receive them resource if record research past., 9, 2006-03-22
806, 129, Student interest catch school system tend world box., 9, 1981-10-12
559, 545, Safe manage job fight part., 6, 1974-10-23
715, 918, Piece PM single two world sound guess., 9, 1993-09-09
215, 674, Audience reach themselves cultural., 9, 2004-12-16
700, 202, Learn really several generation physical speech either., 8, 1971-09-03
490, 808, Around send walk cup value., 6, 1987-05-01
293, 637, Program expert these through story us., 3, 2013-01-10
387, 456, Section large month decision prepare middle expect., 3, 1974-05-26
854, 267, Service message rise sure tend wait., 10, 1992-09-29
515, 49, Cover my give., 5, 1993-06-23
240, 728, Senior increase recently full third style., 7, 1976-09-06
182, 475, Reduce wear trial despite six actually yourself., 10, 1998-12-06
764, 187, Focus sing film thought group man unit., 9, 1983-12-04
685, 49, Trial although seat mind traditional account., 7, 1975-10-05
624, 783, Player least life., 2, 1970-06-08
139, 693, Training catch people ten main., 6, 1981-10-06
390, 226, Military suffer as seem phone view board must., 9, 1984-07-09
45, 785, Child thing our no it lawyer impact single., 3, 1995-05-18
227, 328, Wonder interesting our build., 2, 1993-04-07
504, 312, Notice lead paper., 1, 2010-07-21
376, 120, Ever speech well hour people choose., 4, 1992-08-02
978, 198, Lawyer sport surface thought sister room., 8, 1975-10-15
543, 935, Street require school compare off institution general., 9, 2003-12-09
899, 500, Machine particularly certain check identify compare., 2, 2009-01-20
185, 438, Room never though management magazine series office radio., 5, 2005-06-17
284, 863, Investment assume wonder., 5, 1990-07-14
937, 80, Race affect feeling national., 6, 1972-03-15
41, 662, Nearly line thing success rather sign., 2, 2009-05-22
292, 816, Why lawyer return hour., 2, 1974-07-31
907, 100, Seat near nearly business against yet., 7, 1982-09-13
545, 362, Describe front another check eat world., 6, 1983-06-14
296, 495, Generation impact drop growth middle., 3, 1996-11-15
282, 687, Town could I wide sound use., 7, 1970-10-07
257, 320, Listen guy early time bit lose choose., 8, 1971-09-10
35, 898, Meet follow toward., 4, 1985-09-23
970, 118, Course paper other western region plan., 7, 1971-11-28
834, 574, Say travel require large or general., 1, 1982-04-06
14, 896, Visit bad be common away street certainly woman., 1, 2011-10-03
176, 808, Option attorney less fill head first idea., 1, 1987-04-03
407, 912, Organization fast authority never., 2, 2015-03-30
906, 958, Newspaper shoulder risk morning per sister box., 6, 1995-09-29
512, 461, Reflect of suffer go leader., 3, 2012-10-04
97, 621, Evidence site always guy gun part sound., 10, 1971-03-15
262, 492, Measure baby between., 4, 1976-06-13
891, 687, Population store section television., 4, 2014-04-06
18, 694, Into concern hundred view feel return., 7, 1972-05-11
220, 767, Trial have most history Congress teach., 2, 1999-10-31
293, 238, Bill many entire begin approach., 10, 1995-11-13
766, 23, Large five baby present central., 3, 1985-03-18
563, 312, Remember sometimes affect thousand total., 1, 1971-12-05
525, 580, Security by increase suggest., 6, 1971-12-12
280, 234, Team star according collection art., 9, 1970-11-01
580, 234, Focus car interview activity church., 9, 2002-09-19
55, 489, Have culture with thing partner social., 6, 2011-08-19
79, 917, Kind maintain capital ask marriage., 10, 2004-10-26
235, 184, Subject wait wide serious., 4, 1983-09-21
537, 674, Popular late professional difference picture quite city., 6, 1993-12-11
642, 395, Question peace thought house., 6, 1997-02-25
126, 918, Course benefit never scene., 2, 1994-01-26
318, 471, Campaign base happen long., 3, 1975-04-12
711, 541, Line figure both enjoy act., 3, 1992-02-12
714, 383, Score guy successful reach voice show., 5, 1996-02-29
336, 588, Upon something parent., 2, 1994-07-23
998, 411, Each save front agency future hair threat., 3, 1975-06-16
267, 62, Often mention high fight., 9, 1974-01-25
2, 223, Her environment she education trouble industry important., 9, 2019-05-16
17, 783, Wind street behavior structure go., 8, 2010-09-20
819, 104, Effect management activity there tough tree., 5, 1976-02-08
852, 458, Talk very federal each admit white break group., 7, 1973-02-28
999, 970, Must know myself add organization economy., 5, 1984-04-27
468, 962, Line outside marriage television decide trouble nearly., 10, 2005-02-10
857, 177, Result new decade top., 3, 1976-08-23
960, 133, Minute collection almost., 2, 2000-11-13
183, 32, Couple the director economic happen certain next., 6, 1992-11-29
563, 141, Mind total structure expert media feel., 7, 1972-04-06
716, 184, War beautiful month end., 1, 2018-11-16
910, 453, Bit similar wall Mrs financial record college., 2, 2013-02-26
172, 783, Interview stay investment contain fear manage., 1, 1972-07-12
220, 591, Language accept strong executive close., 5, 1997-05-08
912, 627, Until six or leader., 6, 2001-05-04
424, 471, Describe write represent nice., 10, 1983-09-13
342, 465, Pass listen environmental., 7, 1991-04-25
434, 865, Yes investment school what., 4, 1978-04-06
498, 611, Economic body indicate six image trouble fish., 7, 2013-04-11
465, 350, Might follow pretty plant., 7, 1989-10-14
646, 958, Pressure hit difficult budget., 8, 1997-09-28
281, 901, Anything worry PM possible local race., 10, 1970-12-21
938, 378, Throughout father their various idea no., 6, 1986-12-08
745, 356, Official before position day soldier late herself owner., 7, 1992-05-01
617, 221, Week indeed story claim., 3, 1980-09-08
892, 720, Tend at put someone foot left., 3, 2005-10-20
124, 184, Approach stock despite care third world phone., 5, 1994-06-23
636, 258, Throw positive bit player particular., 2, 1989-10-09
300, 414, Without low painting report make., 4, 1973-04-10
716, 924, Late firm until final determine stay., 4, 2013-01-20
449, 200, Remain box unit back., 9, 1981-04-21
131, 101, Treatment yard among set reflect authority., 6, 1978-05-01
965, 747, Wish seek but degree., 5, 1982-06-29
707, 932, Movement book song difference decade., 7, 2008-09-22
306, 475, Response lay rather for compare clearly pattern allow., 4, 1988-07-14
984, 376, She rather scene current., 1, 1979-11-05
257, 758, Piece second side prove nature research., 5, 2013-06-30
592, 728, Practice Congress role much serve south., 8, 1981-07-25
878, 500, Cup focus already hospital author opportunity such charge., 9, 2004-08-18
836, 258, Thus project just well rock business., 1, 1992-11-25
141, 461, Social personal staff plant color., 4, 2008-12-18
509, 160, Above will late different detail they., 7, 2017-02-26
929, 315, What world give left., 5, 2016-04-05
17, 355, Deal try challenge control out., 8, 1983-08-15
159, 449, Fine already reach finally report., 3, 2002-10-30
441, 524, Mouth why well no., 9, 1987-02-14
197, 529, Recently book present participant., 7, 2009-12-05
648, 200, Positive reason describe consider cut., 8, 2005-01-04
673, 635, Employee loss toward trip why teacher., 3, 1992-01-11
863, 635, Above including cause receive professor lot see., 2, 1980-10-01
31, 997, Score building issue catch., 5, 1975-06-09
897, 712, Financial write fear table behind describe sure point., 5, 2010-10-16
944, 253, Free leave ok gun strategy reach me behind., 5, 1992-02-18
988, 333, Owner walk call drug perhaps south., 1, 1990-11-12
341, 260, Half affect amount education thought face., 9, 1997-12-28
672, 474, Nearly compare many., 4, 2003-03-19
720, 680, Late trial wind thing treat bed toward., 4, 1996-02-09
380, 774, Dark figure state source laugh now manager., 4, 2002-09-08
809, 943, Everything newspaper green., 7, 1981-07-12
850, 814, Begin develop a., 3, 1980-11-21
923, 553, Ability individual respond large walk style., 9, 1997-05-16
206, 891, Well outside push admit watch day., 6, 1993-09-03
836, 348, Garden can think decade fire concern., 7, 2016-12-20
792, 629, Research rest many foreign among., 3, 2018-06-26
34, 200, Song key former defense low condition arrive., 4, 1987-04-07
582, 290, Early create indeed young., 1, 1990-03-25
814, 907, Discuss religious know role camera., 7, 1994-04-23
877, 381, Skill road glass possible simple firm else., 3, 2001-06-05
8, 877, Reveal base put practice act., 10, 1993-07-30
40, 764, Also send learn manager stay clear couple increase., 5, 2005-12-02
489, 930, Hear seat information work., 10, 2019-03-18
391, 633, They case trial view push., 10, 1986-04-10
679, 654, Tell modern suffer born., 4, 2018-07-09
395, 82, Catch color film year can., 8, 1978-01-27
614, 32, Marriage improve plant three., 8, 1984-04-03
195, 264, International parent here law executive ask woman., 7, 2011-10-25
854, 552, Call some between room group., 9, 1992-11-05
473, 501, Nearly city physical use long store., 8, 2008-03-31
359, 325, Share law many than., 9, 1974-10-08
523, 586, Strong southern sing hair., 1, 1993-11-20
627, 460, Paper reduce continue most., 2, 1985-03-25
261, 46, Million medical big risk., 6, 1988-06-30
337, 465, Knowledge stay computer though., 6, 1974-07-11
609, 649, Community sing section test., 1, 2017-10-24
105, 669, Sort attorney economic myself heavy avoid research., 10, 1997-05-14
105, 738, Eight can special long research ten., 1, 2009-02-24
945, 451, Son surface station success discover buy executive., 10, 2006-11-27
315, 556, Series sense stand east tough avoid crime., 3, 2018-11-22
722, 512, Management season career point travel animal., 9, 2015-08-15
187, 8, Board performance manage away control always., 5, 1994-11-19
609, 11, Establish available anyone carry., 2, 1989-03-18
768, 681, Three with gas try management maybe say., 3, 2010-06-24
653, 536, Own current base him down., 8, 1971-11-11
480, 933, Admit body light some., 5, 2013-01-03
404, 964, Group form gas write in spend., 10, 2012-12-29
876, 909, Rise American drive sit think part down., 1, 1991-03-22
942, 238, East peace thought race reality., 8, 1975-09-24
616, 462, Two people there do throw., 5, 2019-08-21
241, 689, Rate product save point significant focus result., 8, 2001-06-12
948, 276, Serve family would best individual., 3, 2019-10-02
988, 881, Activity most theory., 1, 1988-09-07
639, 820, Start positive head church way., 10, 2012-06-30
405, 31, Certainly front long old then something., 6, 1989-01-05
649, 54, Buy break attack police to., 8, 1985-05-21
633, 542, A need father indicate., 9, 2006-10-21
200, 3, Direction watch practice., 8, 1977-06-04
519, 612, Responsibility sure cultural step., 10, 2002-11-15
779, 784, Land newspaper fear rest., 8, 1983-09-13
919, 524, Husband sense four., 8, 2008-05-25
185, 683, Enjoy raise action walk recently near pay environment., 3, 2006-06-09
282, 892, Run similar describe environment specific much gas., 5, 1981-11-30
177, 80, Tough central industry though not create lot., 4, 2019-08-29
429, 493, Up box issue those service Mr., 3, 1996-06-20
664, 608, Board dark identify organization whom through., 8, 2017-02-13
546, 392, Make letter floor pattern out structure physical dream., 1, 2010-09-30
901, 189, That store public whether find., 10, 1994-03-03
272, 803, Day anyone already relationship three rule candidate., 4, 2000-06-02
21, 45, Participant western hotel save turn outside family news., 3, 1998-01-25
461, 96, Strategy campaign play buy chair., 5, 1974-03-08
381, 975, Debate environment but plant., 10, 1997-03-07
224, 705, Seven animal another wait study thousand., 10, 1971-09-02
57, 33, Follow wrong various play of law summer., 9, 1993-12-24
528, 348, Section serve miss involve take shake., 1, 1992-02-12
174, 238, Born available choose reach board job world., 10, 2002-02-02
623, 688, Want just shake rock trade., 7, 1984-09-01
843, 519, Exist perform order cause culture church., 4, 2016-04-15
208, 159, Exactly join ability up break form agency., 3, 1998-11-27
757, 633, Institution note able agreement TV lay., 8, 1987-10-25
828, 104, Security economic sign investment gas., 10, 2019-03-08
823, 313, Administration either question approach story television., 10, 1993-09-11
727, 490, Source human write attorney., 5, 2016-09-16
960, 429, Spend case a include structure., 1, 1993-02-27
965, 751, Explain boy training man participant., 7, 1973-01-02
511, 124, Best approach natural fine condition sometimes discussion., 5, 1970-08-21
32, 923, Occur evening property generation opportunity director., 9, 1978-06-22
271, 892, Reality story seem., 4, 1997-12-02
791, 413, Year begin fear third factor., 5, 1992-04-30
