6, 591, Market cold simple new month long., 10, 1987-01-21
210, 314, Although shake cold some., 2, 1992-11-26
536, 438, Cultural left after color cold I., 10, 2009-11-25
776, 423, At guy but thousand administration magazine., 3, 1999-10-28
899, 756, Unit their though around., 10, 2012-07-31
986, 85, To opportunity record front., 7, 1988-10-12
220, 169, Know though raise grow authority., 5, 2012-01-07
365, 637, Owner point line maybe too., 8, 2009-05-09
917, 808, Such team stage turn., 7, 2004-01-04
694, 97, Never test dinner piece thought fast because group., 9, 1978-03-06
141, 745, Bit say test now you read Congress., 1, 2007-12-12
185, 355, Increase standard natural amount need sea something., 10, 1979-06-28
763, 824, Work key station become., 9, 1997-03-06
393, 101, Watch create nice clear wish., 9, 1989-08-28
223, 967, Democratic analysis edge., 3, 2005-01-08
217, 558, Stuff about blue picture idea., 3, 1981-07-31
431, 219, Could happen kid offer., 5, 1971-10-17
563, 414, Laugh face myself civil recent start., 4, 1974-02-23
498, 319, Food control world value., 8, 2008-02-12
197, 298, To member whether next raise positive early., 8, 2018-08-04
421, 861, Particularly movie agreement knowledge either., 7, 1984-09-03
311, 912, Clear cover good book everyone treat., 9, 1998-01-06
809, 773, Animal investment movie half six dream., 5, 1993-11-11
549, 554, No political best during learn toward language box., 7, 1994-09-04
244, 958, Popular debate watch., 9, 1981-07-07
88, 999, Other training whom move place line., 7, 1974-01-10
955, 774, Buy nature sea none various., 1, 1984-12-29
849, 631, Soon ever their study., 5, 1999-05-16
467, 16, Compare everything defense in crime., 1, 1980-08-04
772, 390, Pick thought evidence recognize push., 10, 1997-06-06
552, 4, Main mission many energy as same Mrs., 8, 2013-04-02
955, 455, Measure return good bag., 2, 2019-09-28
756, 554, Attack hand recognize away great always method., 1, 2018-09-20
694, 811, Activity worker student them nearly., 4, 2013-11-13
994, 55, Treat maybe six say., 2, 1991-03-19
27, 128, Low and figure ask., 10, 2001-05-20
274, 453, Medical world night shoulder room majority performance., 5, 1993-11-01
663, 874, Far five money determine room write international physical., 2, 1998-02-10
440, 643, Represent later citizen four catch., 5, 2006-01-03
9, 860, Light him relationship the., 7, 1977-09-07
739, 143, Community rise turn black effect gun each., 8, 1981-05-04
462, 331, Total through kid experience note., 6, 2001-04-02
429, 128, Job society soldier charge professional game., 8, 1974-08-06
520, 41, Admit fish night trade everything day development., 2, 2003-05-31
643, 813, Market dark special site actually together spend consumer., 3, 2012-01-20
52, 215, Answer her charge across name group sure., 7, 2013-10-19
928, 578, Vote light certainly throw we community., 9, 2011-06-05
698, 578, Others fall among store word., 10, 2004-03-23
951, 893, Tax affect three., 1, 1985-05-14
145, 621, Choice often about way., 8, 1979-12-04
192, 591, Like mother air court reach those yes., 4, 1978-04-22
103, 98, Big trial kind eye him minute customer., 5, 2020-05-02
919, 538, Some within effort campaign., 8, 1970-08-30
830, 644, Remain popular reveal sit yet., 1, 2012-09-18
387, 49, Control office seven put material., 6, 2006-01-22
398, 321, Teacher system fish case successful., 2, 2002-06-09
45, 38, Beautiful part big energy into reveal contain guy., 5, 1997-09-14
573, 765, Environmental laugh analysis tend upon necessary., 1, 2010-01-22
988, 530, Box plan simply agree., 7, 1984-12-11
302, 464, Tv value this page., 9, 1980-08-24
127, 177, Police catch really dream., 7, 1989-04-26
901, 3, Finish standard story Mr., 6, 1971-10-27
173, 82, Back young personal with day break., 9, 1996-02-11
381, 428, Early central daughter past friend start beautiful television., 5, 2007-12-15
409, 634, Even mind way present space., 3, 2001-08-03
497, 236, Away agree candidate positive., 5, 2010-06-27
121, 161, Keep food couple cell., 7, 1978-11-12
976, 982, Could help eye trip sell., 2, 2017-05-27
945, 957, Learn big player food subject finally., 10, 2003-10-11
582, 398, Recognize huge such north trip analysis., 6, 1979-09-16
522, 309, Court factor tend trip method., 7, 2016-07-16
731, 459, Address fact garden., 8, 1973-01-26
355, 280, Every under wear look., 7, 2020-06-11
631, 840, Speak interesting administration already world., 7, 2014-12-29
260, 842, Yard structure international bank they sound evening., 3, 1972-01-07
673, 897, Option two red executive close group possible address., 10, 1986-06-19
941, 349, Leader set large its., 3, 2017-01-07
737, 989, This another already low little really., 6, 2002-10-03
396, 515, Value others have community., 1, 2008-11-11
183, 607, Who modern catch government source tend let., 5, 1992-03-19
297, 211, Garden area Democrat sometimes suddenly yeah election., 9, 1992-07-10
704, 394, Decade always section agree Republican note., 8, 2017-09-07
841, 439, Subject him ask floor many Congress art thought., 6, 1979-06-02
366, 313, Life our three how mission., 4, 1993-05-31
375, 774, Of player generation., 1, 2019-03-08
374, 224, Miss newspaper dark its someone., 8, 1973-07-28
735, 450, Sea time theory person fine section well today., 5, 2004-03-16
905, 996, Herself around when how consider tax pressure., 7, 1996-06-28
690, 586, Success great remember arrive various owner avoid deal., 4, 2018-09-21
477, 491, Subject despite firm statement suggest skill PM., 4, 2011-11-09
887, 678, Discussion piece summer quickly tough final doctor., 1, 1998-06-25
488, 959, Manage expect player., 6, 1978-02-16
993, 59, Citizen guess herself number room seek feeling., 9, 2009-09-07
174, 71, She pick she color consider., 2, 2018-03-17
893, 846, Mind middle open despite according safe., 3, 2014-03-29
977, 950, North various there service., 4, 1976-09-27
413, 215, White clearly yourself discover., 2, 2008-10-24
435, 748, Tax cut international option matter total., 1, 2005-10-17
12, 968, But agree continue., 3, 2000-03-11
725, 420, Recently because girl bad smile prove little reality., 7, 1992-11-25
520, 177, Sister executive product almost car very., 6, 1973-09-16
477, 360, Base Mr fire data each fact., 4, 2004-05-06
645, 961, Toward commercial commercial building think audience though project., 9, 1999-11-12
913, 198, Occur expert few design., 10, 2006-10-16
526, 595, Your occur pressure Mrs., 2, 1997-07-12
132, 867, Energy traditional cell., 8, 1982-04-11
547, 181, Media last standard town new give., 4, 2004-05-08
86, 830, Away pay card in campaign., 9, 1997-04-26
314, 594, Body late structure modern sign senior., 7, 1981-06-29
963, 940, Reason her suddenly develop hot., 2, 2010-01-04
673, 521, Relationship thank fire drive seat too., 5, 1988-04-30
430, 670, Scientist suffer art dark memory., 2, 2009-02-18
11, 647, Clear focus behind move detail poor seven lot., 1, 1980-03-20
353, 607, Decide shake daughter while he play., 5, 1997-08-18
138, 102, Recently focus production respond space degree no., 3, 1991-02-02
858, 185, Lay world enter., 4, 1988-04-21
129, 511, Else stock threat community different., 6, 1973-10-11
333, 730, Plant knowledge agency use positive., 5, 1980-02-03
266, 952, Glass rich you realize woman board., 3, 2002-05-16
233, 670, Door program though learn certain., 1, 2010-02-03
260, 917, Choose exactly bad improve store., 5, 1995-12-28
530, 782, Summer few necessary purpose agreement daughter religious., 1, 1985-02-20
370, 879, Begin position administration., 7, 2012-07-06
243, 749, Amount statement recent time evidence TV child., 7, 2008-03-15
19, 806, Among nearly huge window eight game., 3, 2010-08-29
176, 578, Laugh its home film blood consider., 4, 1988-07-21
987, 963, Huge nor nor again strategy class., 8, 2000-04-21
880, 85, Hundred thank field investment see clear research cold., 3, 1995-05-15
538, 299, Just blue it majority., 7, 1972-07-13
584, 198, Idea back foreign authority laugh region., 3, 1974-02-22
283, 590, Former gas street campaign economy campaign school few., 6, 2009-02-20
342, 915, Leg shake tonight where draw open., 8, 2010-02-20
493, 372, Loss or outside ability., 8, 2007-04-24
433, 88, Culture subject clear rule argue., 2, 2010-06-18
304, 733, Author police party high fine somebody., 1, 1991-08-31
833, 298, Go program case perform three hear west., 7, 2019-05-18
143, 61, Situation street range arm trade glass., 6, 1990-04-18
973, 327, At our car choose light building yourself., 1, 1971-08-18
458, 545, Without however brother trial., 8, 1993-05-13
815, 820, Affect product magazine baby agency writer any bit., 9, 1990-05-23
802, 614, Defense discuss staff tend., 3, 2002-03-07
118, 311, Most agent media state probably player simply., 9, 1973-07-27
770, 885, Claim interest myself., 3, 1970-04-23
56, 632, Share page former skill., 7, 1977-10-13
584, 390, Culture Mr story piece knowledge four fine., 4, 1992-04-28
497, 215, Around remember job level., 3, 2005-08-24
832, 687, Mouth nice thought young push happy., 5, 2002-09-20
676, 635, Few owner walk while nation ball., 3, 2008-09-18
684, 753, Against dream woman dream recognize., 3, 1993-02-25
60, 500, Around chair key wait ability agree attack., 5, 2006-10-05
446, 263, Arrive bar table hear my production list ready., 10, 2016-09-18
592, 356, Investment pick relate onto woman TV., 7, 1982-06-02
78, 690, Remain bank buy food note remain., 8, 1981-04-29
671, 474, Adult mission occur trade everything majority maybe., 2, 2000-12-22
572, 199, Development subject budget evening father., 8, 1988-08-11
811, 937, Relationship want amount left., 7, 1984-07-21
417, 196, Artist behavior environment need sound account activity., 9, 1988-07-18
121, 793, Research choice push large understand movement., 7, 1970-04-28
958, 487, Staff which if in., 6, 2009-12-15
819, 258, Crime today example phone., 1, 2009-05-31
516, 726, Clear foot middle high., 4, 2011-04-14
179, 721, Factor seat me involve., 8, 1981-06-21
977, 266, Bad fine professional most yet recent., 3, 2017-02-13
121, 565, Near game try., 8, 2014-05-07
850, 878, There this everything suffer., 1, 2008-08-02
588, 281, Each build be picture country none week., 4, 2013-11-21
954, 696, Loss teacher miss seek these manage something plan., 4, 1974-10-13
909, 485, Star successful else management question drive., 2, 1991-10-25
17, 15, Writer send ever still available myself., 6, 2015-03-28
847, 123, Recognize say seek study quite window group., 3, 1978-03-28
973, 213, Born thank never lay wrong series there., 5, 2001-03-29
477, 265, Civil compare animal prevent always fire determine., 1, 1995-01-28
112, 9, Send institution player democratic sure weight amount., 2, 1973-06-27
658, 762, Theory but fine everyone., 1, 1973-02-11
17, 194, Through push power method firm exactly., 6, 1987-04-15
661, 843, Type seem accept provide., 3, 2004-08-01
683, 546, Must key forget own argue., 8, 2017-03-02
559, 122, National good sister not young material back public., 10, 1971-04-11
574, 857, Find firm trial information during serious wear., 8, 2020-06-16
255, 303, Car onto trouble third., 2, 2017-05-25
581, 904, In another foreign guy., 6, 1974-02-25
278, 111, My better develop., 3, 2008-04-28
781, 835, Lead prepare expert star., 5, 2019-12-16
331, 660, Action leave difficult minute sort current stage couple., 3, 1978-05-15
324, 37, Media bill guy rise themselves stock dinner., 7, 2013-05-14
231, 687, Week fight executive., 3, 1983-04-05
65, 359, During perform throughout fact notice since task discussion., 1, 2019-03-26
982, 468, Beautiful trip machine someone., 1, 1977-06-17
364, 998, Create put beautiful trade painting back seem arrive., 9, 2015-06-21
563, 157, Home exist our see., 5, 1973-01-12
58, 556, Break car affect kitchen., 5, 2006-01-19
576, 774, Must short worker., 6, 1984-07-03
768, 941, Record manager near knowledge., 6, 2010-08-09
14, 601, Way book sit writer glass myself sure data., 3, 2000-05-19
236, 751, Me those analysis officer serve face concern ready., 1, 2012-10-19
337, 634, Open east effect interest something., 10, 2018-01-01
20, 590, Message police expect some., 4, 1982-10-27
218, 348, Bill total send., 8, 2010-05-02
600, 605, Television forward relate military late sister stand treatment., 4, 1978-08-10
885, 976, Cause American explain news person., 1, 1993-11-06
119, 205, Interest whatever role marriage., 9, 2009-08-17
407, 564, Church message however question., 9, 1995-03-20
490, 542, Position land order benefit Congress., 8, 1983-08-20
864, 434, Low type movement check fear see., 10, 1991-02-10
750, 788, Hundred glass surface senior thousand., 9, 1984-06-28
838, 837, Compare suggest which suffer newspaper yourself senior., 6, 2007-05-08
197, 582, Citizen within hundred marriage student., 2, 2013-10-30
833, 507, Find way actually thing drop., 3, 1977-04-30
739, 952, Task wide become., 5, 1985-06-24
789, 945, Issue job change population., 9, 2017-01-13
122, 781, Economy read election why wait., 6, 2008-11-22
805, 177, Appear mention fly event strong food share., 6, 1992-05-07
977, 210, Improve accept wrong husband., 7, 2020-08-13
262, 702, Organization later accept team hotel., 1, 1981-09-04
917, 79, Either month past prevent lot their., 4, 1972-09-27
104, 846, Someone court police need partner., 3, 1988-07-21
785, 492, Plant floor market local my., 5, 1970-12-25
886, 421, End film instead expert if within more institution., 4, 1972-04-13
779, 705, Product set long traditional party report., 10, 2017-06-06
280, 47, Discuss with task my approach service significant., 1, 2018-06-19
551, 392, Beat chair strong much money produce., 7, 1978-11-13
145, 811, Company take institution draw few scientist whole., 5, 1979-08-31
970, 45, Story short listen see agent add., 9, 2020-06-08
795, 571, Create fact conference every discuss push quite their., 1, 1996-06-25
438, 656, Every management movement remember parent., 7, 2019-04-15
319, 370, Agency clearly human amount store., 1, 1986-09-17
468, 53, Billion ago table old voice., 2, 2004-01-31
184, 841, With start south conference sister amount just fire., 9, 1974-12-31
331, 603, Figure share know night., 6, 1980-03-11
136, 842, Painting such turn man will he six., 2, 1991-10-28
892, 24, Society enough just media., 8, 1978-10-07
142, 99, Audience usually everybody control single father., 6, 1978-03-09
370, 612, Past main cut record carry., 10, 1984-03-23
900, 818, Similar bill magazine industry million could., 4, 1984-11-23
862, 410, Interest according garden., 2, 2015-06-23
190, 242, Decade right mention available simple face ever., 9, 1985-12-24
547, 772, Life leader candidate knowledge political down within., 9, 1987-04-28
224, 36, Whole example before., 10, 1994-07-19
708, 876, Note me thank others generation stock administration country., 9, 1999-02-25
479, 948, Concern office quality its strong., 6, 2000-08-30
665, 961, Despite public real every enjoy remain., 7, 1973-07-27
524, 515, Dog war into professor training material sit., 4, 1977-04-04
378, 175, Understand government really serve night possible note., 7, 1980-01-12
715, 110, Class pick all miss woman increase., 2, 1970-01-20
427, 52, Face big course over person., 5, 1972-11-26
555, 479, Throughout on resource meet least outside past., 1, 2017-01-15
19, 953, Form perform improve modern., 10, 1986-08-07
222, 796, Economy do card hotel wear peace challenge., 10, 2009-07-14
771, 225, Particular southern may every notice., 3, 2017-12-15
748, 666, Western get central leader senior back., 1, 1972-07-07
566, 575, Adult threat she money., 4, 1998-09-23
411, 783, Sit money across party., 10, 2006-11-04
93, 261, Edge training piece sure true power body., 2, 2015-12-29
437, 489, Discussion easy hand writer rate serious., 3, 1979-01-14
796, 770, Eat can begin religious recognize against put., 2, 1970-10-31
922, 628, Scientist toward whatever education behind scene., 8, 1977-06-28
701, 165, Send stage partner movement science sort., 9, 2001-07-23
686, 75, Staff simple beautiful wear before she answer argue., 1, 1982-10-22
22, 93, Owner beautiful deal best key., 8, 1986-12-26
943, 564, Next behavior month Mrs become top., 4, 1999-02-23
198, 558, Expect sport Republican too., 2, 2016-11-09
219, 567, While while though hope throw., 9, 1995-03-29
228, 723, Scene course young prove example., 3, 2002-03-14
857, 89, Data sometimes weight three., 7, 1973-05-19
381, 374, Do newspaper again shake despite., 8, 2015-07-11
309, 483, Majority these mission great manager appear., 1, 2003-05-18
209, 929, Break probably think brother material run again., 3, 1970-08-05
9, 302, Relate hear hard value form., 7, 1990-06-09
65, 587, Economic exactly body way like hundred., 3, 2017-02-20
228, 90, Free now meeting worker analysis approach president., 5, 1991-10-31
550, 481, Whether manager figure shoulder crime step debate., 3, 1992-07-09
881, 489, Imagine usually home., 9, 2005-06-30
853, 266, Rich politics finish raise., 10, 1992-10-13
596, 450, Explain action where plan describe production man over., 8, 2004-03-19
436, 292, Consumer push chair old quite for town., 8, 2001-08-30
413, 95, Since respond size section., 8, 2004-11-29
283, 36, Board amount fast listen pick., 6, 2001-03-02
347, 95, Effect wear writer east remember., 5, 2009-03-28
650, 357, Manage company at exactly job per she., 7, 2004-12-05
946, 584, Industry appear everybody state choice happen society., 10, 1990-05-04
577, 35, Rest together put you lose child., 10, 1985-10-25
778, 573, Everyone white south., 6, 2004-05-29
257, 788, Health effort many each I poor often., 9, 1990-05-08
143, 836, Toward create future window future., 6, 2003-12-21
294, 745, Staff entire coach top to computer expect., 10, 1974-06-23
102, 167, Guess cause believe foreign majority senior., 7, 1976-01-24
312, 54, Culture decade support., 4, 1975-08-05
511, 591, Whose important plant teach store memory., 2, 2006-02-13
235, 769, Especially what go list international pay check back., 4, 2005-10-29
298, 597, So enjoy benefit identify life if., 7, 2017-07-25
714, 721, Leader economy garden dark ask deep time., 2, 1975-03-18
191, 396, Walk good where attention group clear bad., 5, 1983-08-03
569, 156, Parent official training itself contain., 4, 2011-02-21
734, 507, Process play rate sort report see in dog., 7, 1978-08-13
988, 794, Drive prepare rule price institution., 3, 2019-10-07
503, 148, Old many marriage vote where top positive., 5, 2001-03-15
157, 41, Attorney become begin might according budget hit hit., 9, 2012-08-23
907, 311, Travel head argue., 8, 2019-09-05
187, 783, Here heavy risk performance sort cup pay., 3, 2011-06-26
884, 283, Not there coach., 7, 2009-12-23
2, 2, Offer daughter decision improve our side., 10, 1970-11-19
345, 295, Edge lot even between energy., 3, 1999-07-15
220, 884, Difficult computer church staff establish car., 2, 1999-07-04
674, 51, Team school analysis all public election threat., 7, 1971-12-31
633, 344, Energy manager one your action story his., 4, 1990-04-25
456, 373, Particularly learn wait have., 5, 2012-12-23
468, 958, Song find though maybe design stand., 4, 1970-04-11
616, 462, Affect window more heart until particular worker., 8, 1971-07-18
207, 711, He eat add state., 4, 2008-05-23
13, 220, Radio law black school bring defense article., 2, 2006-10-01
763, 598, Admit population until eye music assume., 9, 2017-08-29
917, 661, Deal similar person., 1, 2009-08-12
928, 565, Difference happy true class., 4, 2000-05-24
61, 820, History skin indeed something reason actually Mr Congress., 7, 1985-01-17
747, 423, Focus crime particularly office only dream him newspaper., 7, 1977-12-27
961, 747, Consumer spend product another all chance., 3, 1971-03-11
179, 663, Executive cut town personal personal., 3, 1985-06-13
427, 606, Matter stock create himself possible., 1, 1977-02-10
204, 667, Matter improve woman whose., 6, 2014-09-25
632, 692, High individual rich performance resource vote., 8, 1978-11-03
558, 478, Bill lay to., 3, 1985-06-06
587, 75, Room several describe piece., 7, 2016-10-31
744, 949, Arm couple here mission., 4, 2016-03-03
928, 253, Either hair inside him teacher require character goal., 2, 1979-03-19
19, 948, Cultural realize through thank by interest., 1, 1986-04-10
945, 690, Black trip agree often., 9, 1972-11-04
450, 734, Simple nice sure assume., 6, 2007-04-05
355, 4, Indeed similar population local., 9, 1997-07-12
163, 54, Talk financial light decide down talk physical., 10, 2017-10-01
128, 209, Board your fly turn buy., 6, 1994-07-12
5, 420, Nature generation protect can hand more prevent big., 10, 1990-03-24
145, 785, Behind suffer gas better., 2, 1987-02-04
896, 362, Institution say measure avoid., 9, 1991-02-28
680, 796, Lead go like model rich., 9, 2015-05-07
178, 628, Admit media main., 3, 2001-11-15
796, 692, Writer relate poor., 9, 1981-02-21
10, 752, Suddenly up community worker however window take knowledge., 7, 2006-12-12
570, 215, Bed test show operation score day., 4, 2006-07-09
920, 194, None hear require country., 9, 1975-01-02
732, 472, Field month more start light appear heavy part., 3, 2010-03-12
876, 223, Not alone value energy employee represent., 2, 2004-09-12
926, 499, Push way purpose show skill., 9, 1985-06-10
428, 627, Hold particular economy policy little., 9, 1984-02-05
758, 945, Treat choice water case concern through Republican modern., 7, 1977-03-20
424, 391, Manage majority from interest., 5, 2017-12-23
19, 342, Find kind group pressure player easy suffer increase., 9, 1973-03-15
756, 330, Understand go on., 9, 1977-03-01
55, 900, School country site table heart., 4, 1987-09-30
829, 447, Great size data assume economic majority improve., 1, 1997-07-11
128, 688, Wish difficult national though., 7, 2013-07-21
974, 449, Expert benefit mother key back kid., 1, 2006-10-26
873, 257, For apply apply time by over enjoy industry., 8, 2000-09-26
409, 258, Arm perform situation., 6, 2004-01-02
948, 985, Thus sport skin., 1, 1970-02-28
436, 295, At crime which trip sort simply., 6, 2007-11-30
821, 475, Need discover successful season party beyond., 10, 1970-04-22
214, 351, Accept brother law whether relationship provide admit., 1, 1997-10-31
354, 187, After hair full mean education require., 3, 1970-04-17
590, 480, Heavy quality imagine official between no heart., 10, 1986-02-21
84, 65, Interview color try sign so act., 4, 2018-03-01
314, 161, Per plant test include interesting pretty., 7, 1983-07-27
871, 720, White suggest forward explain show senior if., 7, 2015-03-10
447, 224, Course source describe cost., 6, 1992-07-25
821, 624, Say those trip material a pressure office., 3, 1989-08-15
555, 208, Somebody tax individual national control else current., 2, 1972-05-11
133, 416, Toward effect per these still magazine., 8, 2002-10-12
897, 846, Gun program anything film increase really go., 2, 2007-09-15
353, 892, A western science box job., 1, 2004-03-18
907, 534, Stand line cause draw get recent hotel., 8, 1999-06-20
736, 239, Better they clearly loss., 1, 2000-11-20
929, 257, Control consider word after adult., 10, 1970-11-25
653, 817, Close institution camera hot try management be., 1, 1982-11-12
712, 941, Build have defense soldier., 8, 1982-02-07
407, 58, Can turn sell car shake rock fund., 6, 2001-02-02
709, 169, Picture inside those., 8, 1982-02-16
162, 875, Wrong former become city require democratic only., 5, 1988-05-29
607, 448, Sign hair local issue allow wish., 3, 2009-11-14
138, 823, Yeah center allow once., 4, 1985-03-19
237, 545, Into matter down sell mean., 8, 1997-10-14
114, 655, Son officer parent thousand suffer., 8, 2005-06-11
579, 465, Who under red know learn travel., 10, 2010-10-17
920, 498, Western trial team speak., 8, 1986-03-11
326, 551, Evidence beautiful note common difficult., 5, 1989-10-04
426, 101, Best provide unit admit space personal left., 5, 1999-07-25
847, 515, Would wife claim town always model., 8, 1970-07-28
523, 78, Despite star fly discussion sing interest far., 4, 1996-04-30
747, 477, Medical even after interest offer could life seek., 7, 1974-03-30
458, 445, Education million say rich firm question play., 3, 1992-02-22
955, 123, Particular sign region experience., 2, 1973-02-26
282, 550, Clearly decade speech single subject., 1, 2002-07-30
963, 734, Skin smile hundred., 6, 2010-09-21
519, 824, Girl see about six across benefit no., 1, 2000-08-15
892, 10, Country guess science avoid prevent including take hit., 3, 1981-11-23
957, 271, Base scene instead station try prove citizen., 9, 1999-11-24
758, 592, Could official whom want toward., 9, 2004-02-18
652, 362, Sing military effort better this visit., 10, 1976-01-09
800, 686, I dream movement all responsibility radio., 6, 1978-09-03
719, 593, Important matter provide occur., 7, 2002-01-07
756, 179, Reflect glass nature president., 10, 2017-06-26
292, 5, Ready already side campaign magazine history forward., 4, 1993-11-17
511, 656, Experience home study accept book within floor economy., 6, 1993-04-23
7, 429, Heart police military sport., 8, 2007-04-10
886, 786, Player bit exactly three member raise capital that., 2, 2003-10-17
300, 93, Deal go civil available Mrs evidence into., 9, 1989-08-02
877, 64, According dog hair sister central audience., 4, 1981-07-10
934, 308, Help size political key adult view wife., 6, 2011-08-27
378, 231, Soldier present play make sport front., 6, 1973-07-28
825, 669, Part result within off should., 5, 1985-10-20
377, 352, Clear lose expert reality find hope water., 3, 1999-12-10
