707, 186, Material decide approach within doctor company., 4, 1995-03-16
31, 294, Bed model daughter no allow live., 2, 1997-12-09
721, 504, List gun specific whatever collection spend standard., 8, 1988-11-19
232, 989, Tell increase everything away receive lawyer., 8, 2001-10-13
885, 452, Yeah man drop stock couple job follow., 1, 2010-06-08
535, 42, Traditional garden whether risk them., 10, 2012-10-22
841, 352, Population wonder deal current special many cultural., 6, 1990-07-23
961, 433, Understand lay walk couple drive., 7, 1976-04-16
962, 388, Run until from dog., 2, 1991-09-29
205, 203, Represent owner hundred seek close together table., 8, 1991-03-03
473, 527, Detail have team fear image culture., 9, 2017-04-27
60, 823, Trade compare population economy before game., 8, 1997-06-08
203, 43, Have near compare poor attorney notice cell., 9, 1972-04-08
578, 460, Issue star rise fight smile dream east., 7, 2006-12-27
140, 792, Skill recently final issue explain attack leave., 7, 1971-01-06
368, 749, Why memory than offer., 7, 2007-10-20
535, 71, Fight listen drive television., 4, 1993-09-21
426, 959, Green area street travel end., 3, 2010-02-23
144, 553, Hotel follow wall., 6, 2004-07-03
180, 791, Bit include administration individual behavior indicate however you., 2, 1982-02-28
914, 684, News situation adult price., 1, 2009-04-24
655, 438, Receive activity relate bag because cut., 4, 1990-04-13
23, 33, Section every news increase several., 7, 1997-07-30
356, 695, Perhaps friend cultural make., 8, 1994-07-30
994, 805, Fill child reflect in lead when body., 6, 2018-05-12
955, 544, Hour theory threat put why shake., 7, 1975-03-22
49, 657, What college generation after not political create need., 7, 2007-01-28
436, 941, Forget check never whatever., 8, 2009-10-11
322, 114, Minute spring right anything., 10, 2011-01-28
262, 685, Anyone open Republican mention., 2, 1973-02-10
451, 585, Democrat as light store., 1, 1985-03-22
954, 991, Tv nearly theory exist part though., 6, 2018-05-31
112, 916, Policy increase save front resource., 1, 2018-01-14
751, 736, Many set control., 5, 1992-12-30
681, 18, Could support she stop outside community., 9, 1989-01-15
241, 750, Doctor beat determine., 4, 1998-07-13
102, 615, Maintain work turn east., 7, 2010-01-26
685, 141, Store bank book president magazine time draw., 7, 1996-09-21
948, 212, Statement quickly most tend amount kid amount., 9, 1972-11-01
897, 580, Political development or think., 2, 1999-10-31
443, 342, Keep fine participant spend medical already analysis., 8, 2005-03-14
242, 491, Help standard brother bad young., 4, 1975-07-16
497, 986, Food before city cup oil husband red provide., 7, 1985-05-27
720, 207, Range like bank think various., 2, 1994-05-30
677, 863, Civil size lot form yard him send economy., 9, 1991-06-18
962, 954, Clearly six buy bit despite., 10, 2016-12-21
622, 463, Religious none anything foot section positive., 5, 1974-12-09
649, 755, Light box wait truth., 5, 2002-10-18
234, 771, Everything American whatever born say., 2, 2019-01-08
979, 360, Even visit somebody late., 2, 2018-06-19
768, 972, Lawyer serve interview bar offer information animal., 2, 1991-02-23
27, 661, Drop behind well remember., 3, 1978-08-31
54, 897, Rather seat appear many., 9, 1992-12-06
330, 30, Weight theory whether quality space return surface court., 10, 1992-11-29
528, 491, Night possible actually determine under medical., 7, 2011-02-10
848, 620, Suffer finish most population., 1, 2017-05-06
400, 762, Certainly listen enjoy gun meet firm action., 5, 1991-10-06
747, 21, Almost head question politics system after member., 6, 1971-10-25
806, 589, Detail tonight sort attack third six yeah., 6, 2002-08-13
234, 781, Report affect figure always movement., 10, 2012-06-11
121, 952, Certainly word new seat attorney smile spend., 10, 2009-07-14
294, 102, Every their important southern clearly role station several., 10, 1994-11-08
924, 756, Often work whole ready movie special pay., 2, 1997-12-04
164, 78, Seven professional leave., 7, 1985-11-10
27, 235, Think but green nor north new., 8, 1981-05-10
940, 63, Set north whole me first quite order resource., 1, 1970-08-11
511, 180, Career base or still phone exactly into., 5, 1984-05-29
415, 401, Our fire woman sound., 4, 2011-05-22
832, 229, Per oil building beat., 6, 1983-03-28
547, 957, Number but natural entire something major travel data., 9, 1979-03-31
530, 710, Name whether out likely., 6, 1985-06-02
994, 768, Decision mouth heavy great ever., 3, 1996-06-10
127, 574, Whose such make worry hair., 7, 1972-02-05
510, 554, Traditional general today rather tax strategy state church., 6, 1994-02-20
47, 511, People me worker forget modern., 4, 1981-11-09
543, 942, Again act increase media partner key special., 9, 1986-07-11
503, 927, Last commercial begin tend professional by., 2, 1984-01-13
241, 344, Wrong than among parent., 8, 1998-10-24
370, 669, Against line gas election work., 9, 1992-05-17
963, 227, Beat culture million field few smile., 9, 1970-07-22
156, 542, Nearly effort best receive., 4, 2001-11-12
293, 837, From understand accept pick., 9, 1974-03-10
909, 2, House heavy discover almost be hundred national available., 7, 1974-10-18
368, 568, Among look coach father increase laugh attack., 6, 2015-08-29
588, 66, Rate brother goal similar improve more., 4, 1998-08-22
897, 363, Production catch key future second newspaper land., 9, 2009-02-28
724, 880, Activity pay candidate about., 3, 2000-08-22
96, 945, Form nice hospital thank size., 9, 1990-10-27
547, 722, Apply letter next pull fine activity energy maybe., 10, 1976-02-09
33, 4, Ok assume politics per kitchen., 1, 2005-03-04
363, 740, Establish sure physical., 6, 1997-12-09
832, 4, Mouth understand against., 7, 1994-04-16
65, 43, Window follow once choice positive., 7, 1981-10-30
90, 67, Claim thousand all number., 7, 2007-09-26
2, 878, Our follow expert generation learn turn customer., 3, 1984-09-22
727, 362, Wear system until plant leader laugh act loss., 5, 1982-03-13
472, 358, Reality force second clearly., 10, 1979-03-30
177, 610, Social whom include remain fish employee history., 3, 2015-03-11
795, 127, Final apply two son action., 10, 2005-03-28
454, 653, Truth prevent couple business place., 6, 2004-07-24
587, 977, Price civil affect opportunity bag., 7, 1985-04-30
336, 213, For effort tough ten statement., 7, 2015-07-10
986, 118, Tough church head recently then., 9, 1970-10-24
98, 200, Blue campaign single stuff religious authority real., 9, 1977-03-17
652, 465, Mr seek maybe piece very mother., 7, 1985-11-04
349, 11, Life whether return machine., 8, 2011-10-12
928, 27, Can give relate approach trade senior recognize., 4, 1998-11-16
407, 270, Rock enter wife day customer., 9, 2013-02-11
896, 846, Eight it black Mrs data likely., 6, 1980-07-11
154, 388, Half age study effort account step., 7, 1979-04-28
451, 634, Finally cell north before who already education., 10, 1987-08-01
795, 371, Career book family sort night., 6, 1999-08-27
509, 22, Interview address candidate without body., 6, 1983-10-29
169, 219, Bill field find they pattern nor establish., 9, 1973-01-17
400, 520, Decide water organization lay same meet., 2, 1978-09-11
75, 411, Recently attack American worker., 5, 1982-05-27
411, 781, Around something case issue within check create class., 4, 1989-06-02
488, 795, It teach whom western., 1, 1980-12-13
121, 446, Power similar push bar report everything close., 9, 2016-05-23
281, 558, Someone size theory free anything image coach sell., 1, 1980-11-02
961, 95, Protect rest particular past no concern many., 2, 2020-07-01
737, 176, System effect hot these surface., 3, 1995-02-09
131, 551, Any after sense so agreement., 10, 1973-07-31
157, 564, Give because vote Congress born., 8, 2004-09-07
949, 779, Together note leg government attorney huge final responsibility., 6, 1986-10-27
747, 531, Week tell other., 4, 1979-01-28
371, 140, Address rise kind beyond clear ok boy., 4, 2001-08-31
129, 763, Manage can word gun color American glass light., 6, 1989-07-13
481, 538, Score more support., 1, 2006-07-21
806, 468, Lawyer customer member life., 1, 2002-11-23
959, 820, Tend movie popular science event., 2, 1990-03-28
541, 712, Issue poor project., 5, 2020-03-01
209, 438, Rock site stage purpose enter., 9, 1973-12-03
147, 349, Mission million college even design especially., 7, 1983-03-27
519, 497, Opportunity audience million., 7, 1982-02-04
150, 967, Consumer remember that eight fast catch., 5, 1997-10-29
221, 357, Involve thus either rate someone use., 5, 1998-09-01
68, 314, Whether expect law pick either., 2, 1990-02-16
677, 278, Enter order certain fear evening soldier life state., 3, 1992-05-18
912, 287, Raise call key newspaper player., 3, 2017-12-13
27, 679, Break eight ready class specific easy., 3, 2016-01-03
395, 276, Price Mrs family speech no section career., 6, 2016-10-10
211, 1000, Stage stay finally since she since prove., 5, 2008-12-23
363, 770, Together indicate structure at upon memory., 4, 2008-07-12
68, 360, Cost he herself., 6, 2000-04-18
662, 888, Factor close among pretty image occur., 10, 1973-02-08
252, 69, Long edge performance good continue fear decade prove., 8, 1995-01-02
292, 577, Point eat site west nature., 1, 1988-04-14
768, 670, Detail compare check once., 9, 1988-03-17
639, 1, Analysis peace American room family receive ability., 5, 1981-11-19
376, 423, Record cup because read million police toward., 10, 2000-09-25
87, 488, My miss not show nice., 10, 1982-09-04
50, 829, Husband although nature dog similar chair determine., 7, 2009-03-13
244, 830, Interest able at., 7, 1998-03-04
724, 104, Simply think history box million century attention., 6, 2020-01-26
823, 85, Economic attention call success., 2, 2004-12-09
700, 964, Fall evening key call determine., 5, 2017-07-03
230, 764, Red pay require hope leader fear there., 7, 2017-06-26
318, 72, Would include some less., 4, 1989-02-04
769, 644, Knowledge there learn house instead., 9, 1977-11-02
580, 956, Blood body offer., 4, 1981-06-06
384, 296, Person color though indicate decide senior., 6, 1971-12-03
817, 662, Everyone stay charge image charge culture., 10, 2016-04-07
119, 652, Light chair money door reality., 7, 1974-03-28
920, 663, Feel choose arm decision., 7, 2002-08-22
454, 164, Watch ball trip program want director own., 3, 2008-02-16
100, 112, Win political bank then case allow bit central., 8, 1976-09-26
171, 973, Second tend present too first series., 3, 1970-04-12
459, 424, Tv treat unit capital agent agency up southern., 1, 1976-12-10
811, 954, Score color more enter main until dream., 1, 2009-05-11
774, 973, Wait middle student among attention few past., 10, 1974-10-07
982, 160, Simply here source manager simply she., 5, 2012-04-06
330, 608, Scientist than project officer fear artist easy evening., 3, 1971-10-10
969, 565, Real type parent board finish blood make., 5, 1972-10-30
29, 586, Under Congress few seven., 8, 1974-06-09
75, 920, Child open fast father end., 6, 1982-12-29
